{
  "organizationId": "my-organization",
  "id": "gold-plan",
  "name": "Gold Plan",
  "description": "A premium API access plan with rate limiting and quota policies.",
  "createdBy": "admin",
  "createdOn": "2026-01-15T10:00:00.000Z",
  "policies": [
    {
      "policyDefinitionId": "RateLimitingPolicy",
      "configuration": "{\"limit\":1000,\"granularity\":\"Minute\",\"limit\":100}"
    },
    {
      "policyDefinitionId": "QuotaPolicy",
      "configuration": "{\"limit\":10000,\"granularity\":\"Day\"}"
    }
  ]
}
